category,product_url,review,rating
Baju,https://www.lazada.co.id/products/pdp-i7261980969-s14301254145.html,"alhamdulillah udh nyampe, maaf vidio dan foto tdk sesuai karena baju sudah diambil sma pemilik nya, bagus bajunya, next bakal order lg k",5
Baju,https://www.lazada.co.id/products/pdp-i7261980969-s14301254145.html,"Bahan nyaman dan lembut, Banyak pilihan warna, Blouse serbaguna untuk segala kesempatan, Desain stylish dan trendy, maaf foto tidak sesuai",5
Baju,https://www.lazada.co.id/products/pdp-i7261980969-s14301254145.html,"Bahan nyaman dan lembut, Fashion oversize untuk tampilan trendy,",5
Baju,https://www.lazada.co.id/products/pdp-i7261980969-s14301254145.html,"Blouse serbaguna untuk segala kesempatan, Bahan berkualitas premium, Bahan nyaman dan lembut,",5
Baju,https://www.lazada.co.id/products/pdp-i7261980969-s14301254145.html,"Gaya fesyen, Kualitas bagus, Sesuai ukuran, Dibuat dengan baik, alhamdullilah da sampai .bajunya adem bagus. amanah tokonya sesuai makash lazada.mad seller .mas kurir",5
Baju,https://www.lazada.co.id/products/pdp-i7261980969-s14301254145.html,"Bahan nyaman dan lembut, Blouse serbaguna untuk segala kesempatan, Banyak pilihan warna, Desain stylish dan trendy, respon penjual cepat, pengiriman tepat waktu",5
Baju,https://www.lazada.co.id/products/pdp-i7261980969-s14301254145.html,"Sempurna untuk remaja dan dewasa, Blouse serbaguna untuk segala kesempatan, Pilihan ukuran yang luas untuk segala bentuk tubuh, Bahan berkualitas premium, Bahan nyaman dan lembut,",5
Baju,https://www.lazada.co.id/products/pdp-i7261980969-s14301254145.html,"Paketnya sudah sampai . bajunya sesuai sesuai dengan yg dipesan, bahannya halus adem . nyaman dipakai . aku bb 66kg ambil UK XL masih sedikit longgar. jahitan rapi . 26rb dapet 2 karna aku pengguna baru jadi d kasih vocer diskon . sellernya amanah, ramah dan fast respon . makasih buat kurir , sukses selalu buat seller dan lazada🙏",5
Baju,https://www.lazada.co.id/products/pdp-i7261980969-s14301254145.html,"Banyak pilihan warna, Bahan nyaman dan lembut, Gaya blouse Korea yang modis, Bahan berkualitas premium, Blouse serbaguna untuk segala kesempatan, Sempurna untuk remaja dan dewasa,",5
Baju,https://www.lazada.co.id/products/pdp-i7261980969-s14301254145.html,Bahan:,4
Baju,https://www.lazada.co.id/products/pdp-i7261980969-s14301254145.html,"Bahan berkualitas premium, Blouse serbaguna untuk segala kesempatan, Bahan kringkel airflow yang unik,",5
Baju,https://www.lazada.co.id/products/pdp-i7261980969-s14301254145.html,bagusssssss bajunya pengiriman super cepat sehari udh sampe sesuai pesanan warna&ukuran bb 63kg size xl masih longgar yak,5
Baju,https://www.lazada.co.id/products/pdp-i7261980969-s14301254145.html,"Sempurna untuk remaja dan dewasa, Desain stylish dan trendy, Pilihan ukuran yang luas untuk segala bentuk tubuh,",5
Baju,https://www.lazada.co.id/products/pdp-i7261980969-s14301254145.html,"Pilihan ukuran yang luas untuk segala bentuk tubuh, Fashion oversize untuk tampilan trendy, Blouse serbaguna untuk segala kesempatan, Banyak pilihan warna, Bahan nyaman dan lembut, Gaya blouse Korea yang modis, Sempurna untuk remaja dan dewasa, Desain stylish dan trendy,",5
Baju,https://www.lazada.co.id/products/pdp-i7261980969-s14301254145.html,"paket sudah sampai,, terimakasih barang sangat memuaskan ,,",5
Baju,https://www.lazada.co.id/products/pdp-i7261980969-s14301254145.html,bahan cringkle.. puas banget.. sesuai pilihan warnanya.. bagusss puolll.. dpt harga murah karna koin.. thanks lazada,5
Baju,https://www.lazada.co.id/products/pdp-i7261980969-s14301254145.html,"bagus, ukuran juga pas buat aku yg BB 49kg.. sesuai dengan harga lah, bahan kringkelnya bukan yg premium tapi Ok lah..",5
Baju,https://www.lazada.co.id/products/pdp-i7261980969-s14301254145.html,"Desain stylish dan trendy, Sempurna untuk remaja dan dewasa, Blouse serbaguna untuk segala kesempatan,",5
Baju,https://www.lazada.co.id/products/pdp-i7261980969-s14301254145.html,paketnya cepat sampai bju nya bagus bahan nya lembut nyaman untuk di pakai tokonya amanh saya pesen ini yg kedua kalinya pokonya ga nyesel bagus banget dengan harga sangat terjangkau..trimakadih,5
Baju,https://www.lazada.co.id/products/pdp-i7261980969-s14301254145.html,"Bahan nyaman dan lembut, Fashion oversize untuk tampilan trendy, Gaya blouse Korea yang modis, Pilihan ukuran yang luas untuk segala bentuk tubuh,",5
Baju,https://www.lazada.co.id/products/pdp-i7261980969-s14301254145.html,Po jilbab instan anak Bahan jersey premium Usia 3-9 th Tidak mudah kusut Dipakai nyaman halus dan dingin Hrga 20.000 saja 🫶🏻,5
Baju,https://www.lazada.co.id/products/pdp-i7261980969-s14301254145.html,sampai...uk oke muat bgt malah ternyat jumbo😊👍mantap.lumayanlah utk harga segitu packing rapi.awalnya mau lsg psn dua tp agk ragu tkt g muat.skr g ragu lagii mgkn next order lagi.toko amanah sesuai pesenan.,5
Baju,https://www.lazada.co.id/products/pdp-i7261980969-s14301254145.html,subhanallah alhmdulilah psn bju atasan3.sesuai wrn.sesuai gmbr.bhn nya crinkle asli.pokok nya kseluruhan tdk ada yg kurang.respon nya baik.pngrmn cpt.mksh ya kk.sdh amnh smg sukses buat toko nya brkah buat smua nya amiiiin.😍😘👍👍❤❤❤❤❤❤❤,5
Baju,https://www.lazada.co.id/products/pdp-i7261980969-s14301254145.html,"Alhamdulillah paketnya cepet bgt sampe, bb saya 83 tb saya 150 , bahannya lembut dan adem, tp tipis lumayan nerawang, y sesuai harga lah yah, mungkin klo beli dg warna lebih gelap tidak semenerawang putih, tp over all ini rekomended, cringkel tp adem g panas, terimakasih seller dan kurir",5
Baju,https://www.lazada.co.id/products/pdp-i7261980969-s14301254145.html,"Sempurna untuk remaja dan dewasa, Bahan kringkel airflow yang unik, Pilihan ukuran yang luas untuk segala bentuk tubuh,",4
Baju,https://www.lazada.co.id/products/pdp-i7261980969-s14301254145.html,"Pilihan ukuran yang luas untuk segala bentuk tubuh, Bahan berkualitas premium, Blouse serbaguna untuk segala kesempatan, langganan di toko ini",5
Baju,https://www.lazada.co.id/products/pdp-i7261980969-s14301254145.html,"Bahan kringkel airflow yang unik, Bahan berkualitas premium, Fashion oversize untuk tampilan trendy, Pilihan ukuran yang luas untuk segala bentuk tubuh,",5
Baju,https://www.lazada.co.id/products/pdp-i7261980969-s14301254145.html,"Waahh bagus tokonya amanah semoga sukses terus ya,, bahan y adem sesuai yg di foto kualitas bagus sangt memuaskan next order lg nnti,, buat abang kurir y jg best sdh langganan makasih",5
Baju,https://www.lazada.co.id/products/pdp-i7261980969-s14301254145.html,"Sempurna untuk remaja dan dewasa, Fashion oversize untuk tampilan trendy, Blouse serbaguna untuk segala kesempatan,",5
Baju,https://www.lazada.co.id/products/pdp-i7261980969-s14301254145.html,"Pengiriman cepat, paketnya dikemas rapi, warna nya sesuai, tentunya saya suka, thanks seller & kurir, amanah selalu🥰",5
Baju,https://www.lazada.co.id/products/pdp-i7261980969-s14301254145.html,"Fashion oversize untuk tampilan trendy, Banyak pilihan warna, Bahan kringkel airflow yang unik, Sempurna untuk remaja dan dewasa, Fashion oversize untuk tampilan trendy,",5
Baju,https://www.lazada.co.id/products/pdp-i7261980969-s14301254145.html,"Fashion oversize untuk tampilan trendy, Pilihan ukuran yang luas untuk segala bentuk tubuh, Banyak pilihan warna,",5
Baju,https://www.lazada.co.id/products/pdp-i7261980969-s14301254145.html,"Desain stylish dan trendy, Pilihan ukuran yang luas untuk segala bentuk tubuh, pengiriman yang sangat cepat",4
Baju,https://www.lazada.co.id/products/pdp-i7261980969-s14301254145.html,"Gaya blouse Korea yang modis, Pilihan ukuran yang luas untuk segala bentuk tubuh, Banyak pilihan warna,",5
Baju,https://www.lazada.co.id/products/pdp-i7261980969-s14301254145.html,"Desain stylish dan trendy, Sempurna untuk remaja dan dewasa, Fashion oversize untuk tampilan trendy,",5
Baju,https://www.lazada.co.id/products/pdp-i7261980969-s14301254145.html,"Sempurna untuk remaja dan dewasa, Bahan nyaman dan lembut, Fashion oversize untuk tampilan trendy, Gaya blouse Korea yang modis, Desain stylish dan trendy, Banyak pilihan warna, Blouse serbaguna untuk segala kesempatan, Bahan kringkel airflow yang unik,",5
Baju,https://www.lazada.co.id/products/pdp-i7261980969-s14301254145.html,"Pilihan ukuran yang luas untuk segala bentuk tubuh, Fashion oversize untuk tampilan trendy, Desain stylish dan trendy,",5
Baju,https://www.lazada.co.id/products/pdp-i7261980969-s14301254145.html,Alhdulillah barang datang cukup cepat. Barang bagus dengan harga yang murah. belum ngecek satu2 karena belinya 4 semua ukuran,5
Baju,https://www.lazada.co.id/products/pdp-i7261980969-s14301254145.html,"Pilihan ukuran yang luas untuk segala bentuk tubuh, Gaya blouse Korea yang modis, riel pick sesuai gambar aku suka🥰 makasih seller lazada🫰🫰",5
Baju,https://www.lazada.co.id/products/pdp-i7261980969-s14301254145.html,"Pilihan ukuran yang luas untuk segala bentuk tubuh, Gaya blouse Korea yang modis, Desain stylish dan trendy,",4
Baju,https://www.lazada.co.id/products/pdp-i7261980969-s14301254145.html,"Desain stylish dan trendy, Sempurna untuk remaja dan dewasa, Pilihan ukuran yang luas untuk segala bentuk tubuh,",5
Baju,https://www.lazada.co.id/products/pdp-i7261980969-s14301254145.html,"Banyak pilihan warna, Pilihan ukuran yang luas untuk segala bentuk tubuh, Sempurna untuk remaja dan dewasa, Bahan nyaman dan lembut,",5
Baju,https://www.lazada.co.id/products/pdp-i7261980969-s14301254145.html,"Kualitas bagus, Sesuai ukuran, Kain yang nyaman, Mudah dipadukan, Bahan lembut dan nyaman, Cocok untuk berbagai kesempatan,",5
Baju,https://www.lazada.co.id/products/pdp-i7261980969-s14301254145.html,"Pilihan ukuran yang luas untuk segala bentuk tubuh, Desain stylish dan trendy, Gaya blouse Korea yang modis,",5
Baju,https://www.lazada.co.id/products/pdp-i7261980969-s14301254145.html,"Blouse serbaguna untuk segala kesempatan, Desain stylish dan trendy, Bahan kringkel airflow yang unik, Bahan nyaman dan lembut, Gaya blouse Korea yang modis,",5
Baju,https://www.lazada.co.id/products/pdp-i7261980969-s14301254145.html,allhamdulilah amanah baju atasan nyah aku suka banget modelnya unik jahitan nyah jg rapih inssa Alloh mau PSN lg pokonya sukses buat smuanya🤗🙏👍👍👍👍👍,5
Baju,https://www.lazada.co.id/products/pdp-i7261980969-s14301254145.html,"Bahan kringkel airflow yang unik, Gaya blouse Korea yang modis, Bahan nyaman dan lembut, Banyak pilihan warna,",5
Baju,https://www.lazada.co.id/products/pdp-i7261980969-s14301254145.html,"Pilihan ukuran yang luas untuk segala bentuk tubuh, Bahan kringkel airflow yang unik, Fashion oversize untuk tampilan trendy,",4
Baju,https://www.lazada.co.id/products/pdp-i7261980969-s14301254145.html,"Blouse serbaguna untuk segala kesempatan, Bahan berkualitas premium, Gaya blouse Korea yang modis,",5
Baju,https://www.lazada.co.id/products/pdp-i7261980969-s14301254145.html,"Desain stylish dan trendy, Blouse serbaguna untuk segala kesempatan, Sempurna untuk remaja dan dewasa, Bahan berkualitas premium, Bahan nyaman dan lembut,",5
Baju,https://www.lazada.co.id/products/pdp-i7261980969-s14301254145.html,"Alhmdllh bajunya bagus ,bahan halus adem modelnya jg ok ,jahitan lumayan rapi ,abang kurirnya baik dah langganan",5
Baju,https://www.lazada.co.id/products/pdp-i7261980969-s14301254145.html,Sumpah Bagus sekali 🤩🤩 Bahan crinkle adem ukuran besar Harga Murah kualitas mewah 👍👍 jangan Ragu beli di toko ini 😍 Sukses sLalu Toko & Lazada 😇😇🙏🙏,5
Baju,https://www.lazada.co.id/products/pdp-i7261980969-s14301254145.html,makasih Lazada bajunya dah sampai dan bagus makasih untuk tokonya amanah. selalu pertahankan kualitas dan kepercayaan pelanggan sukses selalu.,5
Baju,https://www.lazada.co.id/products/pdp-i7261980969-s14301254145.html,"Bahan berkualitas premium, Pilihan ukuran yang luas untuk segala bentuk tubuh, Desain stylish dan trendy,",5
Baju,https://www.lazada.co.id/products/pdp-i7261980969-s14301254145.html,"Gaya blouse Korea yang modis, Sempurna untuk remaja dan dewasa, mf Poto ga sesuai tp blus ya asli cantik makasih tokonya amanah 😊",5
Baju,https://www.lazada.co.id/products/pdp-i7261980969-s14301254145.html,bagus banget bajunya..adem. lumayan harga segitu..trmakasih ya ..tokonya amanah..pertahankan terus smoga berkah..terimakasih juga buat pak kurir..nanti order lagi..temenku PD suka,5
Baju,https://www.lazada.co.id/products/pdp-i7261980969-s14301254145.html,paket sudah di terima sesuai dengan pesanan makasih lazada 🙏 🙏 Kualitas bagus Sesuai ukuran pas di badan ku mksih sellernya amanah,5
Baju,https://www.lazada.co.id/products/pdp-i7261980969-s14301254145.html,"Bahan nyaman dan lembut, Bahan berkualitas premium, Bahan kringkel airflow yang unik, Sempurna untuk remaja dan dewasa, pokonya amanah tokonya....semoga makin sukses mkasih juga buat babang kurirnya",5
Baju,https://www.lazada.co.id/products/pdp-i7261980969-s14301254145.html,"Kualitas bagus, Sesuai ukuran, Dibuat dengan baik, Kain yang nyaman, Warna menarik, Allhhaammdduulliillaah sangat senang sekali dgn model nya 👍👍👍👍👍 Pokok nya gx Nyesel dech blnja di toko yg Amanah ini & Trimkasich Yoo pda Kaka penjual toko ini 👌👌👌👍👍👍👍❤️❤️❤️❤️ dech poko nya Trimkasich jua pd mas Kurir yg sdh Langganan dn Trimkasich jua pd Lazada Indonesia ini 👍👍👍👍",5
Baju,https://www.lazada.co.id/products/pdp-i7261980969-s14301254145.html,"bahanya tebal adem modelnya juga bagus pesan size M 2 size L 1 pcs tp diksh s8ze L 2, size M 1 tanpa konfirmasi. tp ga apa2 bedanyanya hari beberapa cm trm ksj",5
Baju,https://www.lazada.co.id/products/pdp-i7261980969-s14301254145.html,"Bahan berkualitas premium, Desain stylish dan trendy, Gaya blouse Korea yang modis, Bahan kringkel airflow yang unik, Bahan nyaman dan lembut, Blouse serbaguna untuk segala kesempatan,",5
Baju,https://www.lazada.co.id/products/pdp-i7261980969-s14301254145.html,"Blouse serbaguna untuk segala kesempatan, Bahan nyaman dan lembut, Sempurna untuk remaja dan dewasa, Bahan kringkel airflow yang unik, Fashion oversize untuk tampilan trendy, Desain stylish dan trendy, Banyak pilihan warna,",5
Baju,https://www.lazada.co.id/products/pdp-i7261980969-s14301254145.html,"pengiriman cepat, seller ramah banget walaupun toko lain pada overload menjelang lebaran, tapi seller berusaha buat kirim tepat waktu. thank you. maaf foto tidak sesuai produk, baju & desainnya bagus.",5
Baju,https://www.lazada.co.id/products/pdp-i7261980969-s14301254145.html,"Desain stylish dan trendy, Blouse serbaguna untuk segala kesempatan,",5
Baju,https://www.lazada.co.id/products/pdp-i7261980969-s14301254145.html,"Bahan kringkel airflow yang unik, Desain stylish dan trendy, Blouse serbaguna untuk segala kesempatan, Bahan nyaman dan lembut,",5
Baju,https://www.lazada.co.id/products/pdp-i7261980969-s14301254145.html,"Sempurna untuk remaja dan dewasa, Bahan nyaman dan lembut, Pilihan ukuran yang luas untuk segala bentuk tubuh,",5
Baju,https://www.lazada.co.id/products/pdp-i7261980969-s14301254145.html,"Bahan kringkel airflow yang unik, Bahan nyaman dan lembut, Fashion oversize untuk tampilan trendy,",5
Baju,https://www.lazada.co.id/products/pdp-i7261980969-s14301254145.html,bju ny bagus tp fto ny GK SMA bju ny keburu d rendem mo d cuci dulu😁🥰👍Size：passssss d BB q 57 Design：bagus modis Material：cryncel,5
Baju,https://www.lazada.co.id/products/pdp-i7261980969-s14301254145.html,"Pilihan ukuran yang luas untuk segala bentuk tubuh, Bahan nyaman dan lembut, Fashion oversize untuk tampilan trendy, Blouse serbaguna untuk segala kesempatan,",4
Baju,https://www.lazada.co.id/products/pdp-i7261980969-s14301254145.html,"Bahan kringkel airflow yang unik, Blouse serbaguna untuk segala kesempatan, Gaya blouse Korea yang modis, Banyak pilihan warna, Sempurna untuk remaja dan dewasa, Fashion oversize untuk tampilan trendy, terimakasih seller next order lgi",5
Baju,https://www.lazada.co.id/products/pdp-i7261980969-s14301254145.html,"barang sesuai pesanan,bahannya lembut pengiriman cepat pokonya makasih lazada dan tokonya,,tetap amanah semoga makin sukses",5
Baju,https://www.lazada.co.id/products/pdp-i7261980969-s14301254145.html,"Blouse serbaguna untuk segala kesempatan, Banyak pilihan warna, Bahan berkualitas premium, bagus berkualitas nyaman di pakai sangat whorit sekali saya senang dengan baju ini sjsiwwownsbeuwuwuwujehbsdyd7w8iwjsdbsuwuwuwjwnwhuuwhwjlove",4
Baju,https://www.lazada.co.id/products/pdp-i7261980969-s14301254145.html,"Kualitas bagus Sesuai ukuran Dibuat dengan baik Gaya fesyen Kain yang nyaman Warna menarik pokonya saya suka bngt. mksh yah lazada.. sudah amanah.. baru donlot lazada lg, sekalinya pesen sangat puassss...",5
Baju,https://www.lazada.co.id/products/pdp-i7261980969-s14301254145.html,bajunya bagus lembut saya suka.mau beli lagi warna hitam.top amanah prnirimanya cepat dua hari nyampai.,5
Baju,https://www.lazada.co.id/products/pdp-i7261980969-s14301254145.html,"Bahan berkualitas premium, Desain stylish dan trendy, Pilihan ukuran yang luas untuk segala bentuk tubuh,",5
Baju,https://www.lazada.co.id/products/pdp-i7261980969-s14301254145.html,"Bahan berkualitas premium, Banyak pilihan warna, Gaya blouse Korea yang modis, Blouse serbaguna untuk segala kesempatan, sumpah bagus bgt lah untuk harga segitu ..",5
Baju,https://www.lazada.co.id/products/pdp-i7261980969-s14301254145.html,"Blouse serbaguna untuk segala kesempatan, Desain stylish dan trendy, Bahan kringkel airflow yang unik, Fashion oversize untuk tampilan trendy, Sempurna untuk remaja dan dewasa,",5
Baju,https://www.lazada.co.id/products/pdp-i7261980969-s14301254145.html,"Gaya blouse Korea yang modis, Fashion oversize untuk tampilan trendy, Bahan berkualitas premium, Pilihan ukuran yang luas untuk segala bentuk tubuh,",5
Baju,https://www.lazada.co.id/products/pdp-i7261980969-s14301254145.html,"Bahan kringkel airflow yang unik, Pilihan ukuran yang luas untuk segala bentuk tubuh, Bahan nyaman dan lembut,",5
Baju,https://www.lazada.co.id/products/pdp-i7261980969-s14301254145.html,"Sempurna untuk remaja dan dewasa, Gaya blouse Korea yang modis, Banyak pilihan warna, Pilihan ukuran yang luas untuk segala bentuk tubuh, Bahan kringkel airflow yang unik, Desain stylish dan trendy, 👍👍",5
Baju,https://www.lazada.co.id/products/pdp-i7261980969-s14301254145.html,"paketnya dah smpe ,, bajunya bagus,, cuma bagian tangannya kurang panjang ,agak gantung,, lumayan lahh , makasih seller , makasih Lazada n Abang kurir 🙏",5
Baju,https://www.lazada.co.id/products/pdp-i7261980969-s14301254145.html,"Blouse serbaguna untuk segala kesempatan, Fashion oversize untuk tampilan trendy, Desain stylish dan trendy,",5
Baju,https://www.lazada.co.id/products/pdp-i7261980969-s14301254145.html,"pesanan sudah sampai, size xl pas di bb 65.suka sekali. tapi bahannya kayak ga nyerap keringat yaa,buat seller nya makasih,prosesnya cepat pengiriman jg cepat,kemarin pesan hari ini sampai 👍🏼 sukses terus buat tokonya,terima kasih jg mas kurir, baek bgt,ramah.sukses lazada ❤️❤️",5
Baju,https://www.lazada.co.id/products/pdp-i7261980969-s14301254145.html,wow... baju nya cakep ternyata .. size nya juga ga salah kirim .. makasi toko nya amanah bangett Sesuai ukuran Kualitas bagus Kain yang nyaman Warna menarik,5
Baju,https://www.lazada.co.id/products/pdp-i7261980969-s14301254145.html,"Pilihan ukuran yang luas untuk segala bentuk tubuh, Bahan nyaman dan lembut, Banyak pilihan warna, Bahan kringkel airflow yang unik, Fashion oversize untuk tampilan trendy,",5
Baju,https://www.lazada.co.id/products/pdp-i7261980969-s14301254145.html,"Sempurna untuk remaja dan dewasa, Bahan berkualitas premium, Blouse serbaguna untuk segala kesempatan, Banyak pilihan warna, Pilihan ukuran yang luas untuk segala bentuk tubuh,",5
Baju,https://www.lazada.co.id/products/pdp-i7261980969-s14301254145.html,"baguss bangeett dengan harga 30an, ukurannya juga pass. adminnya fast respon bangeett minta dikirim secepatnya langsung dikirim. recommended toko best bangeett. thank you seller semoga sukses selalu.",5
Baju,https://www.lazada.co.id/products/pdp-i7261980969-s14301254145.html,"Bahan berkualitas premium, Bahan kringkel airflow yang unik, Banyak pilihan warna, real pick bagusss bgttt",5
Baju,https://www.lazada.co.id/products/pdp-i7261980969-s14301254145.html,alhamdulillah barang sudah diterima ukuran pas warna sesuai bahan lumayan adem toko amanah sesuai dengan pesanan,5
Baju,https://www.lazada.co.id/products/pdp-i7261980969-s14301254145.html,"Bahan kringkel airflow yang unik, Sempurna untuk remaja dan dewasa, Blouse serbaguna untuk segala kesempatan, Bahan nyaman dan lembut, Banyak pilihan warna,",5
Baju,https://www.lazada.co.id/products/pdp-i7261980969-s14301254145.html,"bgs,sesuai deskripsi,ukuran enak dipakai jahitan rapi,rancangan model kekinian trm ksh ya pertahankan amanah,tp kalau mau order LG jgn dinaikan harganya ya,kalau bisa turun sdkt",5
Baju,https://www.lazada.co.id/products/pdp-i7261980969-s14301254145.html,Bahan：crinkle Ukuran：sesuai Rancangan：modis sangat udah langganan di toko ini dan ga pernah kecewa karena emang sebagus itu bajunya. ini ntah udah pembelian yg ke berapa puluh pcs 😀,5
Baju,https://www.lazada.co.id/products/pdp-i7261980969-s14301254145.html,"barang sdh diterima dengan baik... bagus juga tyta meski bahan agak nerawang... txu lazada, kurir n toko",5
Baju,https://www.lazada.co.id/products/pdp-i7261980969-s14301254145.html,paket nya cepat sampai bahan bagus lembut dan nyaman di pakai ini saya pesen yg kedua kali nya tokonya amanh pokonya ga nyesel beli nya harganya sangat terjangkau trimakasuh,5
Baju,https://www.lazada.co.id/products/pdp-i7261980969-s14301254145.html,"bahannya asli krinkel cakep,sya udh koleksi 5 warna,dn sekarang LG order warna hitam dn sage.tinggal nunggu paketnya dtng.pokoknya g nyesel order disini.tokonya amanah.tks🤗",5
Baju,https://www.lazada.co.id/products/pdp-i7261980969-s14301254145.html,"Fashion oversize untuk tampilan trendy, Bahan berkualitas premium, Blouse serbaguna untuk segala kesempatan, Banyak pilihan warna, seller memang 👍👍👍👍👍☺️",5
Baju,https://www.lazada.co.id/products/pdp-i7261980969-s14301254145.html,"Gaya blouse Korea yang modis, Bahan berkualitas premium, Fashion oversize untuk tampilan trendy, Pilihan ukuran yang luas untuk segala bentuk tubuh,",5
Baju,https://www.lazada.co.id/products/pdp-i7261980969-s14301254145.html,"Bahan nyaman dan lembut, Sempurna untuk remaja dan dewasa, Bahan berkualitas premium, Fashion oversize untuk tampilan trendy, Bahan kringkel airflow yang unik,",5
Baju,https://www.lazada.co.id/products/pdp-i7261980969-s14301254145.html,"Gaya blouse Korea yang modis, Desain stylish dan trendy, Banyak pilihan warna, Fashion oversize untuk tampilan trendy,",5
Baju,https://www.lazada.co.id/products/pdp-i7261980969-s14301254145.html,"Blouse serbaguna untuk segala kesempatan, Banyak pilihan warna, Fashion oversize untuk tampilan trendy,",5
Baju,https://www.lazada.co.id/products/pdp-i7261980969-s14301254145.html,"Blouse serbaguna untuk segala kesempatan, Desain stylish dan trendy Banyak aneka pilihan warna menarik",5
Baju,https://www.lazada.co.id/products/pdp-i7261980969-s14301254145.html,"bagus,, bahannya crinkle,, Alhamdulillah sellernya amanah,, dan responnya baik,, makasih banyak yaaaa🫰Sempurna untuk remaja dan dewasa, Pilihan ukuran yang luas untuk segala bentuk tubuh,",5
Baju,https://www.lazada.co.id/products/pdp-i7261980969-s14301254145.html,"Pilihan ukuran yang luas untuk segala bentuk tubuh, Desain stylish dan trendy, Blouse serbaguna untuk segala kesempatan,",5
Baju,https://www.lazada.co.id/products/pdp-i7261980969-s14301254145.html,"Gaya blouse Korea yang modis, Blouse serbaguna untuk segala kesempatan, Bahan berkualitas premium, Bahan nyaman dan lembut,",5
Baju,https://www.lazada.co.id/products/pdp-i7261980969-s14301254145.html,"bajunya cantik ukurannya pas, aku kira bakal kekecilan pakai ukuran M untuk bb aku yang 50 tb 150 tapi ternyata passs",5
Baju,https://www.lazada.co.id/products/pdp-i7261980969-s14301254145.html,"Bahan nyaman dan lembut, Pilihan ukuran yang luas untuk segala bentuk tubuh, Gaya blouse Korea yang modis,",5
Baju,https://www.lazada.co.id/products/pdp-i7261980969-s14301254145.html,okeee,5
Baju,https://www.lazada.co.id/products/pdp-i7261980969-s14301254145.html,"Desain stylish dan trendy, Bahan berkualitas premium, Blouse serbaguna untuk segala kesempatan, Gaya blouse Korea yang modis,",5
Baju,https://www.lazada.co.id/products/pdp-i7261980969-s14301254145.html,"maaf fotonya gak sesuai, tapi bajunya bagusssss banget untuk TB 150 dan BB 50 ngga kebesaran ngga kekecilan bagus bgggggtttttt maakaciwwww",5
Baju,https://www.lazada.co.id/products/pdp-i7261980969-s14301254145.html,"oke pas sesuaiii dengan deskripsiii bagus modelnya, sangan rekomendeed sekaliiiii ok bgt siiiiiip",5
Baju,https://www.lazada.co.id/products/pdp-i7261980969-s14301254145.html,"Sempurna untuk remaja dan dewasa, Gaya blouse Korea yang modis,",5
Baju,https://www.lazada.co.id/products/pdp-i7261980969-s14301254145.html,Alhamdulillah paketnya dah sampai dalam keadaan baik dan pengiriman nya pun cepat masyaallah sekali bajunya bagus banget ukurannya pun pas bahan nya pun bagus adem tebel juga g nerawang thank abang kuring dan selernya 💯💯🙏🙏🙏🙏,5
Baju,https://www.lazada.co.id/products/pdp-i7261980969-s14301254145.html,"Desain stylish dan trendy, Sempurna untuk remaja dan dewasa, Bahan kringkel airflow yang unik, Bahan nyaman dan lembut,",5
Baju,https://www.lazada.co.id/products/pdp-i7261980969-s14301254145.html,"Bahan nyaman dan lembut, Desain stylish dan trendy, Fashion oversize untuk tampilan trendy, Pilihan ukuran yang luas untuk segala bentuk tubuh,",5
Baju,https://www.lazada.co.id/products/pdp-i7261980969-s14301254145.html,"Sempurna untuk remaja dan dewasa, Banyak pilihan warna, Pilihan ukuran yang luas untuk segala bentuk tubuh,",5
